{
  "schema_version": "1.0.0",
  "artifact_type": "run_manifest",
  "contract_id": "ctr-minimal",
  "run_id": "run-minimal",
  "status": "completed",
  "started_at": "2026-07-14T20:00:00Z",
  "ended_at": "2026-07-14T20:01:00Z",
  "inputs": [
    {
      "input_id": "input-file",
      "contract_input_id": "primary-data",
      "uri": "tests/fixtures/minimal-run/data/input.tsv",
      "media_type": "text/tab-separated-values"
    }
  ],
  "external_sources": [],
  "environment": {
    "runtimes": [
      {
        "name": "Python",
        "version": "3.x"
      }
    ],
    "packages": []
  },
  "steps": [
    {
      "execution_id": "exec-feature",
      "step_id": "test-feature",
      "implementation": {
        "kind": "manual",
        "ref": "fixture"
      },
      "invocation": "fixture calculation",
      "parameters": {},
      "rationale": "Prespecified fixture method.",
      "status": "completed",
      "artifact_ids": ["artifact-result"],
      "stochastic": false
    }
  ],
  "artifacts": [
    {
      "artifact_id": "artifact-result",
      "output_id": "result-table",
      "kind": "table",
      "uri": "tests/fixtures/minimal-run/results/result.tsv",
      "status": "produced",
      "media_type": "text/tab-separated-values"
    }
  ],
  "quality": {
    "input_qc": {
      "status": "performed"
    },
    "statistical_assumptions": {
      "status": "not_applicable",
      "reason": "The fixture does not fit a statistical model."
    },
    "checks": []
  },
  "deviations": [],
  "extensions": {}
}
