{
  "schema_version": "1.1.0",
  "artifact_type": "run_manifest",
  "contract_id": "ctr-cross-domain",
  "run_id": "run-cross-domain",
  "status": "completed",
  "started_at": "2026-07-15T18:00:00Z",
  "ended_at": "2026-07-15T18:30:00Z",
  "inputs": [
    {
      "input_id": "archive-series-001",
      "contract_input_id": "image-series",
      "locator_kind": "collection",
      "uri": "institutional-archive:series-001",
      "media_type": "application/dicom"
    }
  ],
  "external_sources": [],
  "resources": [
    {
      "resource_id": "measurement-protocol",
      "kind": "protocol",
      "name": "Institutional lesion measurement procedure",
      "version": "1.0",
      "identifier": "SOP-IMAGING-001"
    },
    {
      "resource_id": "measurement-workstation",
      "kind": "instrument",
      "name": "Measurement workstation",
      "serial_number": "WS-EXAMPLE"
    }
  ],
  "environment": {
    "runtimes": [],
    "packages": []
  },
  "steps": [
    {
      "execution_id": "exec-measure-lesions",
      "step_id": "measure-lesions",
      "implementation": {
        "kind": "manual",
        "ref": "SOP-IMAGING-001",
        "version": "1.0"
      },
      "invocation": "Performed SOP-IMAGING-001 in the approved controlled environment.",
      "parameters": {},
      "rationale": "The procedure was prespecified by the analysis contract.",
      "status": "completed",
      "input_ids": ["archive-series-001"],
      "upstream_artifact_ids": [],
      "resource_ids": ["measurement-protocol", "measurement-workstation"],
      "artifact_ids": ["controlled-measurements"],
      "stochastic": false
    }
  ],
  "artifacts": [
    {
      "artifact_id": "controlled-measurements",
      "output_id": "measurement-results",
      "kind": "data",
      "status": "produced",
      "locator_kind": "collection",
      "uri": "controlled-store:measurement-results"
    }
  ],
  "quality": {
    "input_qc": {
      "status": "performed"
    },
    "statistical_assumptions": {
      "status": "not_applicable",
      "reason": "This fixture records a prespecified measurement procedure without a fitted statistical model."
    },
    "checks": []
  },
  "deviations": [],
  "strict": {
    "procedure": {
      "name": "Institutional lesion measurement procedure",
      "version": "1.0",
      "ref": "SOP-IMAGING-001",
      "definition_sha256": "0000000000000000000000000000000000000000000000000000000000000000",
      "resource_id": "measurement-protocol"
    },
    "lockfiles": [],
    "references": []
  },
  "extensions": {}
}
