{
  "schema_version": "1.1.0",
  "artifact_type": "run_manifest",
  "contract_id": "ctr-example",
  "run_id": "run-example",
  "status": "running",
  "started_at": "2026-01-01T00:00:00Z",
  "inputs": [],
  "external_sources": [],
  "resources": [],
  "environment": {
    "runtimes": [],
    "packages": []
  },
  "steps": [],
  "artifacts": [],
  "quality": {
    "input_qc": {
      "status": "not_performed",
      "reason": "Pending execution."
    },
    "statistical_assumptions": {
      "status": "not_performed",
      "reason": "Pending execution."
    },
    "checks": []
  },
  "deviations": [],
  "extensions": {}
}
